{
  "id": "candidates.schedules_follow_the_pinned_zone",
  "kind": "candidates",
  "description": "Sunday 22:30 UTC is Monday 09:30 in the pinned zone, inside a Monday 09:00 to 10:00 window.",
  "given": {
    "ruleset": {
      "schemaVersion": 1,
      "revision": 1,
      "updatedAt": "2026-10-01T00:00:00Z",
      "timeZone": "Australia/Sydney",
      "rules": [
        {
          "id": "r-x-morning",
          "target": {
            "kind": "site",
            "domain": "x.com"
          },
          "mode": "friction",
          "schedules": [
            {
              "days": ["mon"],
              "start": "09:00",
              "end": "10:00"
            }
          ],
          "enabled": true,
          "dailyBudgetMinutes": 10
        }
      ],
      "categories": [],
      "bedtime": {
        "enabled": false,
        "days": ["mon", "tue", "wed", "thu", "fri", "sat", "sun"],
        "start": "22:30",
        "end": "07:00",
        "warnMinutesBefore": 30
      },
      "workHours": {
        "days": ["mon", "tue", "wed", "thu", "fri"],
        "start": "09:00",
        "end": "17:30"
      }
    },
    "now": "2026-10-25T22:30:00Z"
  },
  "when": {
    "target": {
      "kind": "site",
      "urlText": "x.com/home"
    }
  },
  "then": {
    "frictionCandidates": ["r-x-morning"],
    "budgetedRules": ["r-x-morning"]
  }
}
